{
  "schemaVersion": 1,
  "unit": "families/qwen",
  "sources": [
    {
      "id": "alibaba-models",
      "url": "https://www.alibabacloud.com/help/en/model-studio/models.md",
      "kind": "vendor",
      "pageType": "model",
      "fetch": "http",
      "format": "markdown",
      "observedHash": "sha256:28afc15d062d5e61b2e13ef048e217b58dbd022241e2ee015ab08f7cf099bc4f",
      "observedAt": "2026-09-28",
      "reviewedHash": "sha256:28afc15d062d5e61b2e13ef048e217b58dbd022241e2ee015ab08f7cf099bc4f",
      "reviewedAt": "2026-09-28"
    },
    {
      "id": "alibaba-text-models",
      "url": "https://www.alibabacloud.com/help/en/model-studio/text-generation-model.md",
      "kind": "vendor",
      "pageType": "model",
      "fetch": "http",
      "format": "markdown",
      "observedHash": "sha256:dd90f7dce84c2e06a47b88e98b991e2d62d81774884a4efe3728dd891ca0b4cc",
      "observedAt": "2026-10-12",
      "reviewedHash": "sha256:b46de448f178a9565d52917f8ad4e10a5edba98e34c08bbb3f34a49b4c0ed6d0",
      "reviewedAt": "2026-09-28"
    },
    {
      "id": "alibaba-deep-thinking",
      "url": "https://www.alibabacloud.com/help/en/model-studio/deep-thinking.md",
      "kind": "vendor",
      "pageType": "effort",
      "fetch": "http",
      "format": "markdown",
      "observedHash": "sha256:9ff9dc116c01f846e2382145778d9764b217404afc17c7f5a1bcda82beaf7269",
      "observedAt": "2026-10-12",
      "reviewedHash": "sha256:b1f38b2aa4999ac92fd5f0f7560fad9bbb5a4b775fd8c81bdd8cee277af72fb4",
      "reviewedAt": "2026-09-28"
    },
    {
      "id": "alibaba-prompt-guide",
      "url": "https://www.alibabacloud.com/help/en/model-studio/prompt-engineering-guide.md",
      "kind": "vendor",
      "pageType": "guidance",
      "fetch": "http",
      "format": "markdown",
      "observedHash": "sha256:56303c7844f9c21ebb3b38a32d2ed5307e4710a43efa150700d910da089b06e7",
      "observedAt": "2026-10-12",
      "reviewedHash": "sha256:8920703c6498d5bf756c323b34b77a7d96d899be4ef1e689d637c8bb7e136f05",
      "reviewedAt": "2026-09-28"
    },
    {
      "id": "alibaba-release-notes",
      "url": "https://www.alibabacloud.com/help/en/model-studio/release-notes.md",
      "kind": "vendor",
      "pageType": "changes",
      "fetch": "http",
      "format": "markdown",
      "observedHash": "sha256:38ee47c96cd6e18ba798839b2c82b47553bdc9ae0f2f9f6a24480743bba0fae0",
      "observedAt": "2026-09-28",
      "reviewedHash": "sha256:38ee47c96cd6e18ba798839b2c82b47553bdc9ae0f2f9f6a24480743bba0fae0",
      "reviewedAt": "2026-09-28"
    },
    {
      "id": "hf-qwen3.8-27b",
      "url": "https://huggingface.co/Qwen/Qwen3.8-27B",
      "kind": "artifact",
      "pageType": "model",
      "fetch": "huggingface",
      "format": "json",
      "repo": "Qwen/Qwen3.8-27B",
      "observedHash": "revision:1d4bf0f2ff6012fd82039f2fa52739d0dd7c60c0",
      "observedAt": "2026-09-28",
      "reviewedHash": "revision:1d4bf0f2ff6012fd82039f2fa52739d0dd7c60c0",
      "reviewedAt": "2026-09-28"
    },
    {
      "id": "hf-qwen3.8-flash-next",
      "url": "https://huggingface.co/Qwen/Qwen3.8-Flash-Next",
      "kind": "artifact",
      "pageType": "model",
      "fetch": "huggingface",
      "format": "json",
      "repo": "Qwen/Qwen3.8-Flash-Next",
      "observedHash": "revision:de4b8e4d43b917e7706784d8bb445c9af86a3540",
      "observedAt": "2026-09-28",
      "reviewedHash": "revision:de4b8e4d43b917e7706784d8bb445c9af86a3540",
      "reviewedAt": "2026-09-28"
    },
    {
      "id": "hf-qwen3.6-27b",
      "url": "https://huggingface.co/Qwen/Qwen3.6-27B",
      "kind": "artifact",
      "pageType": "model",
      "fetch": "huggingface",
      "format": "json",
      "repo": "Qwen/Qwen3.6-27B",
      "observedHash": "revision:6a9e13bd6fc8f0983b9b99948120bc37f49c13e9",
      "observedAt": "2026-09-28",
      "reviewedHash": "revision:6a9e13bd6fc8f0983b9b99948120bc37f49c13e9",
      "reviewedAt": "2026-09-28"
    },
    {
      "id": "hf-qwen3.6-35b-a3b",
      "url": "https://huggingface.co/Qwen/Qwen3.6-35B-A3B",
      "kind": "artifact",
      "pageType": "model",
      "fetch": "huggingface",
      "format": "json",
      "repo": "Qwen/Qwen3.6-35B-A3B",
      "observedHash": "revision:995ad96eacd98c81ed38be0c5b274b04031597b0",
      "observedAt": "2026-09-28",
      "reviewedHash": "revision:995ad96eacd98c81ed38be0c5b274b04031597b0",
      "reviewedAt": "2026-09-28"
    },
    {
      "id": "hf-qwen3-coder-next",
      "url": "https://huggingface.co/Qwen/Qwen3-Coder-Next",
      "kind": "artifact",
      "pageType": "model",
      "fetch": "huggingface",
      "format": "json",
      "repo": "Qwen/Qwen3-Coder-Next",
      "observedHash": "revision:a7fbcb5c0e12d62a448eaa0e260346bf5dcc0feb",
      "observedAt": "2026-09-28",
      "reviewedHash": "revision:a7fbcb5c0e12d62a448eaa0e260346bf5dcc0feb",
      "reviewedAt": "2026-09-28"
    },
    {
      "id": "hf-qwen3.8-2.4t-a95b",
      "url": "https://huggingface.co/Qwen/Qwen3.8-2.4T-A95B",
      "kind": "artifact",
      "pageType": "model",
      "fetch": "huggingface",
      "format": "json",
      "repo": "Qwen/Qwen3.8-2.4T-A95B",
      "observedHash": "revision:207bd685a7e3696cfaff12ded7c6a7ea0f88c996",
      "observedAt": "2026-09-28",
      "reviewedHash": "revision:207bd685a7e3696cfaff12ded7c6a7ea0f88c996",
      "reviewedAt": "2026-09-28"
    }
  ],
  "notPublished": [],
  "watch": [
    {
      "id": "qwen",
      "kind": "huggingface-org",
      "org": "Qwen",
      "pattern": "Qwen[0-9][0-9A-Za-z.-]*",
      "ignore": [
        ".*-(FP8|AWQ|GGUF|GPTQ.*|Int4|Int8|MLX.*)",
        ".*(Image|VL|Omni|Audio|TTS|ASR|Drive|Embedding|Reranker).*"
      ],
      "seen": [
        "Qwen3-Coder-Next-Base",
        "Qwen3-ForcedAligner-0.6B",
        "Qwen3-ForcedAligner-0.6B-hf",
        "Qwen3.5-0.8B",
        "Qwen3.5-0.8B-Base",
        "Qwen3.5-122B-A10B",
        "Qwen3.5-27B",
        "Qwen3.5-2B",
        "Qwen3.5-2B-Base",
        "Qwen3.5-35B-A3B",
        "Qwen3.5-35B-A3B-Base",
        "Qwen3.5-397B-A17B",
        "Qwen3.5-4B",
        "Qwen3.5-4B-Base",
        "Qwen3.5-9B",
        "Qwen3.5-9B-Base"
      ]
    }
  ]
}
