{
  "schemaVersion": 1,
  "unit": "harnesses/qwen",
  "sources": [
    {
      "id": "qwen-code-headless",
      "url": "https://qwenlm.github.io/qwen-code-docs/en/users/features/headless/",
      "kind": "harness",
      "pageType": "harness",
      "fetch": "http",
      "format": "html",
      "observedHash": "sha256:39eb918a91543c1e8e84d113b7431f1ca2a9eb334aeb9e2e92c4e1a05499990d",
      "observedAt": "2026-10-26",
      "reviewedHash": "sha256:2702c408be751c7fcaf3fe321c7cbc7c5da7c68dd6e26f1ed50edaa8e501657b",
      "reviewedAt": "2026-09-28"
    },
    {
      "id": "qwen-code-approval",
      "url": "https://qwenlm.github.io/qwen-code-docs/en/users/features/approval-mode/",
      "kind": "harness",
      "pageType": "harness",
      "fetch": "http",
      "format": "html",
      "observedHash": "sha256:f33deddda4ee7cabd8f2e019cfaa4e3d1cdd9327e127a0c7a1aac89b6905214b",
      "observedAt": "2026-10-26",
      "reviewedHash": "sha256:c8a9914884e54a55555f29030afbfbf7fc39dd6e966d38eeaa1ed11cf5feca31",
      "reviewedAt": "2026-09-28"
    },
    {
      "id": "qwen-code-sandbox",
      "url": "https://qwenlm.github.io/qwen-code-docs/en/users/features/sandbox/",
      "kind": "harness",
      "pageType": "harness",
      "fetch": "http",
      "format": "html",
      "observedHash": "sha256:29f1c0b938a90883ad9d52813a6940fbb7294e686add33c81f575fcc2215cc50",
      "observedAt": "2026-10-26",
      "reviewedHash": "sha256:7bb0ddce650f8d051c819efa6cf3c9b32225977800ddb47b3d54dea3e17c590d",
      "reviewedAt": "2026-09-28"
    },
    {
      "id": "qwen-code-sub-agents",
      "url": "https://qwenlm.github.io/qwen-code-docs/en/users/features/sub-agents/",
      "kind": "harness",
      "pageType": "harness",
      "fetch": "http",
      "format": "html",
      "observedHash": "sha256:7da5fb8ab174e6fd531f058434b77a94b08387c458b7a8d9b835d249c78cebaf",
      "observedAt": "2026-10-26",
      "reviewedHash": "sha256:79a33e36c70a7deaa3d3ca0187bf6d4b22897d0b2b215b76a9da3e0ae9c368be",
      "reviewedAt": "2026-09-28"
    },
    {
      "id": "qwen-code-providers",
      "url": "https://qwenlm.github.io/qwen-code-docs/en/users/configuration/model-providers/",
      "kind": "harness",
      "pageType": "harness",
      "fetch": "http",
      "format": "html",
      "observedHash": "sha256:ef9f1247aa9063b2806e624f0e036862095ac6e3da1b336bdbf162c0d300d38c",
      "observedAt": "2026-10-26",
      "reviewedHash": "sha256:389d3f0634d88e51f84484ca798dba78aa0ed43aec4aa7c6480d5f1e5bbc3a3b",
      "reviewedAt": "2026-09-28"
    }
  ],
  "notPublished": [
    {
      "pageType": "changes",
      "kind": "harness",
      "searchedAt": "2026-09-28",
      "searched": "https://qwenlm.github.io/qwen-code-docs/llms.txt; release notes are blog posts"
    }
  ],
  "watch": []
}
