{
  "schemaVersion": 1,
  "unit": "families/muse-glimmer",
  "sources": [
    {
      "id": "meta-muse-glimmer",
      "url": "https://dev.meta.ai/docs/muse-glimmer.md",
      "kind": "vendor",
      "pageType": "model",
      "fetch": "http",
      "format": "markdown",
      "observedHash": "sha256:a7e5611a476cdfb79bec1fdc49bd5819bfa309be72ecc0d4dbe549f78248d2b3",
      "observedAt": "2026-10-19",
      "reviewedHash": "sha256:9c7eca1f4df781f70797522a98860b1e6ccd130b5f200cdf8198a03503b335a1",
      "reviewedAt": "2026-09-28"
    },
    {
      "id": "meta-muse-glimmer-prompting",
      "url": "https://dev.meta.ai/docs/muse-glimmer/prompting.md",
      "kind": "vendor",
      "pageType": "effort",
      "fetch": "http",
      "format": "markdown",
      "observedHash": "sha256:12c32f37200e320659abfc30a80f5ed804b0d2efbec1aca7879a6aa11912f2a3",
      "observedAt": "2026-10-19",
      "reviewedHash": "sha256:ab019d9781a82aa065e3f672ca73847bb3d07df712383252e3f98fca4aafb65f",
      "reviewedAt": "2026-09-28"
    },
    {
      "id": "hf-muse-glimmer-30b",
      "url": "https://huggingface.co/meta-models/Muse-Glimmer-30B",
      "kind": "artifact",
      "pageType": "model",
      "fetch": "huggingface",
      "format": "json",
      "repo": "meta-models/Muse-Glimmer-30B",
      "observedHash": "revision:a4e59da52a7bc87ae7251dd5545c0dd437c44b68",
      "observedAt": "2026-09-28",
      "reviewedHash": "revision:a4e59da52a7bc87ae7251dd5545c0dd437c44b68",
      "reviewedAt": "2026-09-28"
    }
  ],
  "notPublished": [
    {
      "pageType": "guidance",
      "kind": "vendor",
      "searchedAt": "2026-09-28",
      "searched": "https://dev.meta.ai/llms.txt; the prompting guide is recorded as the effort source and carries the guidance"
    },
    {
      "pageType": "changes",
      "kind": "vendor",
      "searchedAt": "2026-09-28",
      "searched": "https://dev.meta.ai/llms.txt Muse Glimmer section; no change log"
    }
  ],
  "watch": [
    {
      "id": "meta-models",
      "kind": "huggingface-org",
      "org": "meta-models",
      "pattern": "Muse-Glimmer-[0-9A-Za-z.-]*",
      "ignore": [
        ".*-(GGUF|ExecuTorch.*|assistant)"
      ],
      "seen": []
    }
  ]
}
